wandb: Using wandb-core as the SDK backend. Please refer to https://wandb.me/wandb-core for more information.
wandb: Currently logged in as: mehedihasansun1196 (mehedihasansun1196-William & Mary). Use `wandb login --relogin` to force relogin
wandb: Tracking run with wandb version 0.18.3
wandb: Run data is saved locally in /scratch/projects/mehedi/CSCI646/wandb/run-20241010_202517-v8bh722m
wandb: Run `wandb offline` to turn off syncing.
wandb: Syncing run bright-cherry-16
wandb: ⭐️ View project at https://wandb.ai/mehedihasansun1196-William%20%26%20Mary/csci646-assignment-1
wandb: 🚀 View run at https://wandb.ai/mehedihasansun1196-William%20%26%20Mary/csci646-assignment-1/runs/v8bh722m
Files already downloaded and verified
Files already downloaded and verified
Train Datapoint Count: 45000
Validation Datapoint Count: 5000
Test Datapoint Count: 10000
Device: cuda
Epoch [1/50] - Training Accuracy: 37.93%, Training Loss: 2.9145 - Validation Accuracy: 42.90%, Validation Loss: 1.7485
Saving checkpoint...
Epoch [2/50] - Training Accuracy: 51.56%, Training Loss: 1.7667 - Validation Accuracy: 53.08%, Validation Loss: 1.5246
Saving checkpoint...
Epoch [3/50] - Training Accuracy: 57.96%, Training Loss: 1.5027 - Validation Accuracy: 56.42%, Validation Loss: 1.3555
Saving checkpoint...
Epoch [4/50] - Training Accuracy: 62.56%, Training Loss: 1.3190 - Validation Accuracy: 61.22%, Validation Loss: 1.1533
Saving checkpoint...
Epoch [5/50] - Training Accuracy: 66.02%, Training Loss: 1.1927 - Validation Accuracy: 66.28%, Validation Loss: 1.0230
Saving checkpoint...
Epoch [6/50] - Training Accuracy: 68.28%, Training Loss: 1.0914 - Validation Accuracy: 67.54%, Validation Loss: 0.9974
Saving checkpoint...
Epoch [7/50] - Training Accuracy: 70.57%, Training Loss: 1.0095 - Validation Accuracy: 67.66%, Validation Loss: 0.9762
Saving checkpoint...
Epoch [8/50] - Training Accuracy: 72.03%, Training Loss: 0.9380 - Validation Accuracy: 69.42%, Validation Loss: 0.9391
Saving checkpoint...
Epoch [9/50] - Training Accuracy: 73.70%, Training Loss: 0.8656 - Validation Accuracy: 72.42%, Validation Loss: 0.8283
Saving checkpoint...
Epoch [10/50] - Training Accuracy: 75.05%, Training Loss: 0.8178 - Validation Accuracy: 70.86%, Validation Loss: 0.8495
Epoch [11/50] - Training Accuracy: 78.33%, Training Loss: 0.6885 - Validation Accuracy: 76.64%, Validation Loss: 0.6951
Saving checkpoint...
Epoch [12/50] - Training Accuracy: 79.10%, Training Loss: 0.6562 - Validation Accuracy: 74.58%, Validation Loss: 0.7393
Epoch [13/50] - Training Accuracy: 79.90%, Training Loss: 0.6218 - Validation Accuracy: 73.44%, Validation Loss: 0.7853
Epoch [14/50] - Training Accuracy: 80.66%, Training Loss: 0.6092 - Validation Accuracy: 76.40%, Validation Loss: 0.6896
Saving checkpoint...
Epoch [15/50] - Training Accuracy: 81.19%, Training Loss: 0.5947 - Validation Accuracy: 77.40%, Validation Loss: 0.6614
Saving checkpoint...
Epoch [16/50] - Training Accuracy: 81.44%, Training Loss: 0.5693 - Validation Accuracy: 76.60%, Validation Loss: 0.6905
Epoch [17/50] - Training Accuracy: 82.14%, Training Loss: 0.5444 - Validation Accuracy: 76.74%, Validation Loss: 0.6886
Epoch [18/50] - Training Accuracy: 82.88%, Training Loss: 0.5186 - Validation Accuracy: 77.76%, Validation Loss: 0.6621
Epoch [19/50] - Training Accuracy: 83.21%, Training Loss: 0.5084 - Validation Accuracy: 78.74%, Validation Loss: 0.6041
Saving checkpoint...
Epoch [20/50] - Training Accuracy: 83.81%, Training Loss: 0.4873 - Validation Accuracy: 79.34%, Validation Loss: 0.5935
Saving checkpoint...
Epoch [21/50] - Training Accuracy: 85.39%, Training Loss: 0.4364 - Validation Accuracy: 80.62%, Validation Loss: 0.5677
Saving checkpoint...
Epoch [22/50] - Training Accuracy: 86.13%, Training Loss: 0.4041 - Validation Accuracy: 80.24%, Validation Loss: 0.5767
Epoch [23/50] - Training Accuracy: 86.60%, Training Loss: 0.3975 - Validation Accuracy: 81.14%, Validation Loss: 0.5716
Epoch [24/50] - Training Accuracy: 86.93%, Training Loss: 0.3853 - Validation Accuracy: 81.80%, Validation Loss: 0.5534
Saving checkpoint...
Epoch [25/50] - Training Accuracy: 87.06%, Training Loss: 0.3785 - Validation Accuracy: 81.16%, Validation Loss: 0.5447
Saving checkpoint...
Epoch [26/50] - Training Accuracy: 87.42%, Training Loss: 0.3667 - Validation Accuracy: 81.10%, Validation Loss: 0.5483
Epoch [27/50] - Training Accuracy: 87.54%, Training Loss: 0.3636 - Validation Accuracy: 81.02%, Validation Loss: 0.5546
Epoch [28/50] - Training Accuracy: 87.86%, Training Loss: 0.3492 - Validation Accuracy: 81.88%, Validation Loss: 0.5372
Saving checkpoint...
Epoch [29/50] - Training Accuracy: 88.26%, Training Loss: 0.3412 - Validation Accuracy: 81.30%, Validation Loss: 0.5348
Saving checkpoint...
Epoch [30/50] - Training Accuracy: 88.29%, Training Loss: 0.3379 - Validation Accuracy: 81.78%, Validation Loss: 0.5430
Epoch [31/50] - Training Accuracy: 89.20%, Training Loss: 0.3061 - Validation Accuracy: 82.58%, Validation Loss: 0.5134
Saving checkpoint...
Epoch [32/50] - Training Accuracy: 89.87%, Training Loss: 0.2963 - Validation Accuracy: 83.50%, Validation Loss: 0.4773
Saving checkpoint...
Epoch [33/50] - Training Accuracy: 90.07%, Training Loss: 0.2864 - Validation Accuracy: 82.54%, Validation Loss: 0.5197
Epoch [34/50] - Training Accuracy: 90.03%, Training Loss: 0.2843 - Validation Accuracy: 82.36%, Validation Loss: 0.5122
Epoch [35/50] - Training Accuracy: 90.34%, Training Loss: 0.2770 - Validation Accuracy: 83.14%, Validation Loss: 0.5092
Epoch [36/50] - Training Accuracy: 90.43%, Training Loss: 0.2708 - Validation Accuracy: 82.68%, Validation Loss: 0.4941
Epoch [37/50] - Training Accuracy: 90.53%, Training Loss: 0.2693 - Validation Accuracy: 82.96%, Validation Loss: 0.5162
Epoch [38/50] - Training Accuracy: 90.72%, Training Loss: 0.2673 - Validation Accuracy: 82.92%, Validation Loss: 0.5132
Early stopping triggered!


Test Accuracy: 84.01%


Classification Report:
               precision    recall  f1-score   support

    airplane     0.9015    0.8240    0.8610      1000
  automobile     0.9525    0.9020    0.9266      1000
        bird     0.8532    0.7150    0.7780      1000
         cat     0.7247    0.6870    0.7053      1000
        deer     0.7146    0.9290    0.8078      1000
         dog     0.8142    0.7320    0.7709      1000
        frog     0.7749    0.9430    0.8507      1000
       horse     0.9253    0.8420    0.8817      1000
        ship     0.8934    0.9300    0.9113      1000
       truck     0.9097    0.8970    0.9033      1000

    accuracy                         0.8401     10000
   macro avg     0.8464    0.8401    0.8397     10000
weighted avg     0.8464    0.8401    0.8397     10000


Confusion Matrix:
 [[824   6  30   7  38   3  12  10  50  20]
 [ 11 902   1   2   3   2  13   1  19  46]
 [ 28   0 715  35  97  27  76  14   5   3]
 [  5   0  32 687  74  91  84  11  12   4]
 [  2   1  13  11 929   5  29  10   0   0]
 [  5   1  18 139  60 732  30  10   2   3]
 [  2   1  11  15  20   3 943   3   1   1]
 [  6   1  10  32  62  31  13 842   1   2]
 [ 18   6   4   9  11   3   8   1 930  10]
 [ 13  29   4  11   6   2   9   8  21 897]]
wandb:                                                                                
wandb: 
wandb: Run history:
wandb:          epoch ▁▁▁▂▂▂▂▂▃▃▃▃▃▃▄▄▄▄▄▅▅▅▅▅▆▆▆▆▆▆▇▇▇▇▇███
wandb:  test_accuracy ▁
wandb: train_accuracy ▁▃▄▄▅▅▅▆▆▆▆▆▇▇▇▇▇▇▇▇▇▇▇▇██████████████
wandb:     train_loss █▅▄▄▃▃▃▃▃▂▂▂▂▂▂▂▂▂▂▂▁▁▁▁▁▁▁▁▁▁▁▁▁▁▁▁▁▁
wandb:   val_accuracy ▁▃▃▄▅▅▅▆▆▆▇▆▆▇▇▇▇▇▇▇█▇████████████████
wandb:       val_loss █▇▆▅▄▄▄▄▃▃▂▂▃▂▂▂▂▂▂▂▁▂▂▁▁▁▁▁▁▁▁▁▁▁▁▁▁▁
wandb: 
wandb: Run summary:
wandb:          epoch 38
wandb:  test_accuracy 84.01
wandb: train_accuracy 90.71778
wandb:     train_loss 0.2673
wandb:   val_accuracy 82.92
wandb:       val_loss 0.51315
wandb: 
wandb: 🚀 View run bright-cherry-16 at: https://wandb.ai/mehedihasansun1196-William%20%26%20Mary/csci646-assignment-1/runs/v8bh722m
wandb: ⭐️ View project at: https://wandb.ai/mehedihasansun1196-William%20%26%20Mary/csci646-assignment-1
wandb: Synced 5 W&B file(s), 0 media file(s), 0 artifact file(s) and 0 other file(s)
wandb: Find logs at: ./wandb/run-20241010_202517-v8bh722m/logs
Training and Testing Complete